source_name,source_language,headline_original,headline_english_placeholder,article_url,publication_date,discovery_source,article_snippet,section_guess,subsection_guess,date_status,relevance_status,relevance_reason,relevance_score,priority,source_tier,duplicate_status,story_id,editorial_status,editorial_reason,rejection_reason,qa_status,qa_notes,include_candidate,duplicate_key,parser_used,notes
Libya Observer,en,"Dbeibah, US Chargé d’Affaires discuss unified development program, economic cooperation",,https://libyaobserver.ly/news/dbeibah-us-charge-daffaires-discuss-unified-development-program-economic-cooperation,2026-06-11,https://libyaobserver.ly/news,Libyan Prime Minister Abdul Hamid Dbeibah met on Thursday with US Chargé d’Affaires Jeremy Berndt to discuss bilateral cooperation and a range of economic and development issues of mutual interest.,Military & Security,Military & Security,in_range,accepted,editorial_score:55; section:Military & Security; marker:military,55,HIGH,A,unique,,rejected,low_editorial_value:55<60,low_editorial_value,rejected,Reliable date inside target window and Libya-relevant; low_editorial_value:55<60,no,libya_observer:https://libyaobserver.ly/news/dbeibah-us-charge-daffaires-discuss-unified-development-program-economic-cooperation,libya_observer,
Libya Observer,en,European Union backs Structured Dialogue recommendations,,https://libyaobserver.ly/news/european-union-backs-structured-dialogue-recommendations,2026-06-11,https://libyaobserver.ly/news,"The European Union Delegation and the diplomatic missions of EU member states in Libya have welcomed the conclusion of the UN-facilitated Structured Dialogue, praising its recommendations as the outcome of a “Libyan-led and Libyan-owned” process.",Military & Security,Military & Security,in_range,accepted,editorial_score:55; section:Military & Security; marker:military,55,HIGH,A,unique,,rejected,low_editorial_value:55<60,low_editorial_value,rejected,Reliable date inside target window and Libya-relevant; low_editorial_value:55<60,no,libya_observer:https://libyaobserver.ly/news/european-union-backs-structured-dialogue-recommendations,libya_observer,
Libya Observer,en,Army chief discusses naval cooperation during French ship visit,,https://libyaobserver.ly/inbrief/army-chief-discusses-naval-cooperation-during-french-ship-visit,2026-06-11,https://libyaobserver.ly/news,"Libya’s army chief of staff, Salah al-Din al-Namroush, has discussed boosting naval capabilities with France’s ambassador to Libya, Thierry Vallat, during a visit to Tripoli Naval Base.",Military & Security,Military & Security,in_range,accepted,editorial_score:55; section:Military & Security; marker:army,55,LOW,A,unique,,rejected,low_editorial_value:55<60,low_editorial_value,rejected,Reliable date inside target window and Libya-relevant; low_editorial_value:55<60,no,libya_observer:https://libyaobserver.ly/inbrief/army-chief-discusses-naval-cooperation-during-french-ship-visit,libya_observer,
Libya Observer,en,Authorities identify 27 more Storm Daniel victims in Derna,,https://libyaobserver.ly/news/authorities-identify-27-more-storm-daniel-victims-derna,2026-06-11,https://libyaobserver.ly/news,"The General Authority for the Search and Identification of Missing Persons says it has identified 27 more victims of Storm Daniel in the city of Derna, following DNA analysis.",Varieties,Varieties,in_range,accepted,editorial_score:5; section:Varieties; marker:no_editorial_marker,5,LOW,A,unique,,rejected,low_editorial_value:5<60,low_editorial_value,rejected,Reliable date inside target window and Libya-relevant; low_editorial_value:5<60,no,libya_observer:https://libyaobserver.ly/news/authorities-identify-27-more-storm-daniel-victims-derna,libya_observer,
Libya Observer,en,Journalists’ federations urge release of Spanish reporter detained in Benghazi,,https://libyaobserver.ly/inbrief/journalists-federations-urge-release-spanish-reporter-detained-benghazi,2026-06-10,https://libyaobserver.ly/news,"International and European journalists’ federations have called for the immediate release of Spanish journalist Alicia Armesto, who is being held in Benghazi alongside ni",Varieties,Varieties,in_range,accepted,editorial_score:5; section:Varieties; marker:no_editorial_marker,5,LOW,A,unique,,rejected,low_editorial_value:5<60,low_editorial_value,rejected,Reliable date inside target window and Libya-relevant; low_editorial_value:5<60,no,libya_observer:https://libyaobserver.ly/inbrief/journalists-federations-urge-release-spanish-reporter-detained-benghazi,libya_observer,
Libya Observer,en,"Local governance training wraps up, boosting municipal capacity",,https://libyaobserver.ly/news/local-governance-training-wraps-boosting-municipal-capacity,2026-06-10,https://libyaobserver.ly/news,The Municipal Development and Decentralisation Support Centre at the Ministry of Local Government on Tuesday concluded an intensive training course on the “Fundamentals o,Governance,Government,in_range,accepted,libya_source_topic:government,0,,A,unique,,rejected,no_libya_angle,no_libya_angle,rejected,Reliable date inside target window and Libya-relevant; no_libya_angle,no,libya_observer:https://libyaobserver.ly/news/local-governance-training-wraps-boosting-municipal-capacity,libya_observer,
Libya Observer,en,"Libyan Iron Company, Export Development Authority sign deal to build fishing trawler factory",,https://libyaobserver.ly/inbrief/libyan-iron-company-export-development-authority-sign-deal-build-fishing-trawler-factory,2026-06-10,https://libyaobserver.ly/inbrief,"Libyan Iron and Steel Company and the Export Development Authority signed a memorandum of understanding on Tuesday to establish a factory for fishing trawlers, as part of",Varieties,Varieties,in_range,accepted,keyword_match:libya,0,LOW,A,unique,,rejected,weather_or_daily_bulletin,weather_or_daily_bulletin,rejected,Reliable date inside target window and Libya-relevant; weather_or_daily_bulletin,no,libya_observer:https://libyaobserver.ly/inbrief/libyan-iron-company-export-development-authority-sign-deal-build-fishing-trawler-factory,libya_observer,
Libya Observer,en,GNU orders power plan to manage peak demand,,https://libyaobserver.ly/news/gnu-orders-power-plan-manage-peak-demand,2026-06-10,https://libyaobserver.ly/news,The Government of National Unity (GNU) has instructed the General Electricity Company of Libya (GECOL) to develop a comprehensive technical and operational plan to manage,Governance & Public Services,Public Administration,in_range,accepted,editorial_score:75; section:Governance & Public Services; marker:government,75,MEDIUM,A,unique,story-008,rejected,low_priority_excluded_from_final_report,low_editorial_value,approved,Reliable date inside target window and Libya-relevant,no,libya_observer:https://libyaobserver.ly/news/gnu-orders-power-plan-manage-peak-demand,libya_observer,
