source_name,source_language,headline_original,headline_english_placeholder,article_url,publication_date,discovery_source,article_snippet,section_guess,subsection_guess,date_status,relevance_status,relevance_reason,relevance_score,priority,source_tier,duplicate_status,story_id,editorial_status,editorial_reason,rejection_reason,qa_status,qa_notes,include_candidate,duplicate_key,parser_used,notes
LANA,ar,الطرابلسي: تحقيق الأمن المستدام بات يعتمد على بنية تكنولوجية حديثة ومنظومات سيادية متطورة,,https://lana.gov.ly/post.php?lang=ar&id=359153,2026-06-09,https://lana.gov.ly/category.php?lang=ar&id=8,طرابلس 10 يونيو 2026(وال)-قال وزير الداخلية بحكومة الوحدة الوطنية لواء عماد الطرابلسي إن تحقيق الأمن المستدام بات يعتمد على بنية تكنولوجية حديثة ومنظومات سيادية متطورة تواكب التحديات الأمنية الراهنة. جاء ذلك في كلمة له ال�,Migration,Migration Policy,in_range,accepted,editorial_score:93; section:Migration; marker:هجرة,93,HIGH,A,unique,story-001,approved,passed_editorial_scoring,,approved,Reliable date inside target window and Libya-relevant,yes,lana:https://lana.gov.ly/post.php?lang=ar&id=359153,lana,
LANA,ar,مظاهرات طرابلس وملف الهجرة غير النظامية.. مخاوف متصاعدة وأسئلة تبحث عن إجابات,,https://lana.gov.ly/post.php?lang=ar&id=358757,2026-06-09,https://lana.gov.ly/category.php?lang=ar&id=8,-متابعة وتصوير : فريق والطرابلس 04 يونيو 2026 (وال) - شهدت العاصمة طرابلس، اليوم الخميس، مظاهرات سلمية واسعة شارك فيها مواطنون قدموا من عدة مناطق ومدن ليبية، قبل أن تتجمع الحشود أمام مقر المفوضية السامية لشؤون اللاجئين بمنطق,Migration,Deportation & Enforcement,in_range,accepted,editorial_score:93; section:Migration; marker:هجرة,93,HIGH,A,clustered_cross_source,story-002,approved,passed_editorial_scoring,,approved,Reliable date inside target window and Libya-relevant,yes,lana:https://lana.gov.ly/post.php?lang=ar&id=358757,lana,
LANA,ar,سفارة السودان بليبيا تعلن استعدادها لانطلاق المرحلة الثانية لعودة اللاجئين لبلادهم طوعا,,https://lana.gov.ly/post.php?lang=ar&id=358933,2026-06-09,https://lana.gov.ly/category.php?lang=ar&id=8,طرابلس 07 يونيو 2026 (وال)- أعلنت سفارة السودان لدى ليبيا، اليوم الأحد،أنها ستطلق المرحلة الثانية من برنامج العودة الطوعية لللاجئين السودانيين بالتعاون مع حكومة الوحدة الوطنية وذلك بعد إكمال المرحلة الأولى قبل عطلة عيد ال,Migration,Deportation & Enforcement,in_range,accepted,editorial_score:93; section:Migration; marker:مهاجر,93,HIGH,A,clustered_cross_source,story-002,approved,passed_editorial_scoring,,approved,Reliable date inside target window and Libya-relevant,yes,lana:https://lana.gov.ly/post.php?lang=ar&id=358933,lana,
Libya 24,ar,الشاوش: المجموعة المصغرة 4+4 ستجتمع يوم 21 يونيو في تونس لمراجعة قانون انتخاب الرئيس - ليبيا 24,,https://libya24.tv/2026/06/10/30945/,2026-06-10,https://libya24.tv/category/news/,ليبيا 24 كشف ممثل حكومة الوحدة منتهية الولاية في المجموعة المصغرة 4+4، عبد الجليل الشاوش، عن موعد الاجتماع المقبل للمجموعة، مؤكداً أنه سيُعقد يوم 21 يونيو الجاري بمقر بعثة الأمم المتحدة في العاصمة التونسية تونس، ضمن الجهود المستمرة لدفع المسار السياسي والانتخابي في ليبيا. وأوضح الشاوش أن الاجتماع سيتركز على تجميع الملاحظات والمقترحات المتعلقة بقانون انتخاب رئيس الدولة، ومراجعة المواد التي ما زالت محل نقاش بين الأطراف المشاركة، بهدف معالجة الثغرات والإشكاليات القانونية التي قد تعيق الوصول إلى توا,Regional & International,International Relations,in_range,accepted,editorial_score:85; section:Regional & International; marker:تونس,85,HIGH,A,unique,story-010,approved,passed_editorial_scoring,,approved,Reliable date inside target window and Libya-relevant,yes,libya_24:https://libya24.tv/2026/06/10/30945/,libya_24,
LANA,ar,الشركة العامة للكهرباء تعلن قرب دخول محطة الزوية من الدخول للخدمة,,https://lana.gov.ly/post.php?lang=ar&id=359148,2026-06-10,https://lana.gov.ly/,طرابلس 10 يونيو 2026(وال)- أعلنت الشركة العام للكهرباء اليوم الأربعاء أن محطة الزوية جهد 66 ك.ف تقترب من الدخول للخدمة، حيث وصلت نسبة الإنجاز الكلي للمشروع ... إقرأ المزيد,Governance & Public Services,Public Administration,in_range,accepted,editorial_score:73; section:Governance & Public Services; marker:كهرباء,73,MEDIUM,A,unique,story-003,approved,passed_editorial_scoring,,approved,Reliable date inside target window and Libya-relevant,yes,lana:https://lana.gov.ly/post.php?lang=ar&id=359148,lana,
