source_name,headline,article_url,publication_date,discovery_source,collection_timestamp,audit_status,reason,qa_status,date_status
Libya 24,جهود الحكومة الليبية وصندوق التنمية.. بثبات نحو إعادة إعمار المدن وتأسيس بنية تحتية متينة لمستقبل أكثر استقرارًا - ليبيا 24,https://libya24.tv/2025/12/11/19192/,2025-12-10,https://libya24.tv/category/news/,2026-06-10T15:36:11Z,not_in_final_report,date_conflict,needs_review,date_conflict
Libya 24,خبراء أوروبيون: لا يوجد تفسيرًا علميًا لحرائق الأصابعة وسنقدم تقريرًا مفصلًا للجهات المختصة الأيام المقبلة - ليبيا 24,https://libya24.tv/2025/04/14/2020/,2025-04-13,https://libya24.tv/category/news/,2026-06-10T15:36:11Z,not_in_final_report,date_conflict,needs_review,date_conflict
RNA Reportage,وزير الدفاع الإيطالي: ليبيا لا تزال أولوية استراتيجية لروما وللناتو,https://reportage.ly/وزير-الدفاع-الإيطالي-ليبيا-لا-تزال-أول/,,https://reportage.ly/?s=%D9%84%D9%8A%D8%A8%D9%8A%D8%A7,2026-06-10T15:36:26Z,not_in_final_report,missing_date,needs_review,missing_date
RNA Reportage,تيتيه تقدم لـ”الاتحاد الأفريقي” إحاطة حول ليبيا,https://reportage.ly/تيتيه-تقدم-لـالاتحاد-الأفريقي-إحاطة/,,https://reportage.ly/?s=%D9%84%D9%8A%D8%A8%D9%8A%D8%A7,2026-06-10T15:36:26Z,not_in_final_report,missing_date,needs_review,missing_date
RNA Reportage,بولس يبحث مع “الخارجية المصرية” تطورات الأوضاع في ليبيا,https://reportage.ly/بولس-يبحث-مع-الخارجية-المصرية-تطورات/,,https://reportage.ly/?s=%D9%84%D9%8A%D8%A8%D9%8A%D8%A7,2026-06-10T15:36:26Z,not_in_final_report,missing_date,needs_review,missing_date
RNA Reportage,“المحاسبة”: ليبيا تعتمد على الاستيراد لتوفير 76% من احتياجاتها من الوقود,https://reportage.ly/المحاسبة-ليبيا-تعتمد-على-الاستيراد-ل/,,https://reportage.ly/?s=%D9%84%D9%8A%D8%A8%D9%8A%D8%A7,2026-06-10T15:36:26Z,not_in_final_report,missing_date,needs_review,missing_date
RNA Reportage,تيتيه: المرحلة المقبلة من العملية السياسية في ليبيا ستظل قائمة على جهود يقودها الليبيون,https://reportage.ly/تيتيه-المرحلة-المقبلة-من-العملية-السي/,,https://reportage.ly/?s=%D9%84%D9%8A%D8%A8%D9%8A%D8%A7,2026-06-10T15:36:26Z,not_in_final_report,missing_date,needs_review,missing_date
RNA Reportage,سفارة السودان بطرابلس: رعايانا ليست لديهم أي رغبة بإعادة توطينهم في ليبيا,https://reportage.ly/سفارة-السودان-بطرابلس-رعايانا-ليست-لد/,,https://reportage.ly/?s=%D9%84%D9%8A%D8%A8%D9%8A%D8%A7,2026-06-10T15:36:26Z,not_in_final_report,missing_date,needs_review,missing_date
RNA Reportage,الأمم المتحدة: نشعر بقلق بالغ إزاء الاحتجاجات العنيفة التي اندلعت أمام المفوضية والبعثة الأممية في ليبيا,https://reportage.ly/الأمم-المتحدة-نشعر-بقلق-بالغ-إزاء-الاح/,,https://reportage.ly/?s=%D9%84%D9%8A%D8%A8%D9%8A%D8%A7,2026-06-10T15:36:26Z,not_in_final_report,missing_date,needs_review,missing_date
RNA Reportage,تيتيه تبحث مع دبلوماسيين آخر التطورات في ليبيا ومستجدات تنفيذ خارطة الطريق,https://reportage.ly/تيتيه-تبحث-مع-دبلوماسيين-آخر-التطورات/,,https://reportage.ly/?s=%D9%84%D9%8A%D8%A8%D9%8A%D8%A7,2026-06-10T15:36:26Z,not_in_final_report,missing_date,needs_review,missing_date
RNA Reportage,خبير أرصاد جوية يرصد ظاهرة مناخية استثنائية غير مسبوقة في ليبيا,https://reportage.ly/خبير-أرصاد-جوية-يرصد-ظاهرة-مناخية-استث/,,https://reportage.ly/?s=%D9%84%D9%8A%D8%A8%D9%8A%D8%A7,2026-06-10T15:36:26Z,not_in_final_report,missing_date,needs_review,missing_date
Libya 24,الحوار المهيكل في ليبيا.. هل يعيد إنتاج الحل أم يفتح مساراً جديداً للأزمة؟,https://libya24.tv/2026/06/10/30943/,2026-06-10,https://libya24.tv/,2026-06-10T15:36:11Z,not_in_final_report,missing_article_body,needs_review,in_range
Libya 24,وزير داخلية الحكومة الليبية يتابع إجراءات تنظيم إقامة الوافدين والأجانب داخل البلاد,https://libya24.tv/2026/06/10/30940/,2026-06-10,https://libya24.tv/,2026-06-10T15:36:11Z,not_in_final_report,missing_article_body,needs_review,in_range
Libya 24,طرابلس تستضيف جولة جديدة لبحث الحدود البحرية مع اليونان,https://libya24.tv/2026/06/10/30936/,2026-06-10,https://libya24.tv/,2026-06-10T15:36:11Z,not_in_final_report,missing_article_body,needs_review,in_range
Libya 24,إقليم الوسطى ومؤامرة التوطين: وجهان لاستراتيجية يائسة تهدد وحدة ليبيا وتستهدف قواتها المسلحة,https://libya24.tv/2026/06/10/30927/,2026-06-10,https://libya24.tv/,2026-06-10T15:36:11Z,not_in_final_report,missing_article_body,needs_review,in_range
Libya 24,رؤية اقتصادية من العمق: غيث يشخص تشابك القوانين وينذر بهدر مليارات الدعم,https://libya24.tv/2026/06/10/30923/,2026-06-10,https://libya24.tv/,2026-06-10T15:36:11Z,not_in_final_report,missing_article_body,needs_review,in_range
RNA Reportage,حماد يصدر قرارا بتشكيل اللجنة العليا لمتابعة أوضاع الوافدين والمهاجرين غير القانونيين – وكالة ريبورتاج الإخبارية,https://reportage.ly/حماد-يصدر-قرارا-بتشكيل-اللجنة-العليا-ل/,2026-06-10,https://reportage.ly/,2026-06-10T15:36:26Z,not_in_final_report,missing_article_body,needs_review,in_range
RNA Reportage,انطلاق جلسة اجتماع مجلس الوزراء العادي الثالث – وكالة ريبورتاج الإخبارية,https://reportage.ly/انطلاق-جلسة-اجتماع-مجلس-الوزراء-العاد/,2026-06-10,https://reportage.ly/,2026-06-10T15:36:26Z,not_in_final_report,missing_article_body,needs_review,in_range
RNA Reportage,انطلاق امتحانات شهادة التعليم الأساسي في ليبيا – وكالة ريبورتاج الإخبارية,https://reportage.ly/انطلاق-امتحانات-شهادة-التعليم-الأساس/,2026-06-10,https://reportage.ly/,2026-06-10T15:36:26Z,not_in_final_report,missing_article_body,needs_review,in_range
RNA Reportage,إعادة الوحدة البخارية الثالثة بمحطة كهرباء الزاوية إلى الخدمة – وكالة ريبورتاج الإخبارية,https://reportage.ly/إعادة-الوحدة-البخارية-الثالثة-بمحطة-ك/,2026-06-10,https://reportage.ly/,2026-06-10T15:36:26Z,not_in_final_report,missing_article_body,needs_review,in_range
RNA Reportage,البريقة تعلن استقرار الوضع التشغيلي في مختلف مناطق عملها,https://reportage.ly/البريقة-تعلن-استقرار-الوضع-التشغيلي-ف/,2026-06-09,https://reportage.ly/,2026-06-10T15:36:26Z,not_in_final_report,missing_article_body,needs_review,in_range
RNA Reportage,قادربوه والصور يبحثان ملف المحروقات وآليات تمويل القطاع النفطي وسبل تعزيز الشفافية,https://reportage.ly/قادربوه-والصور-يبحثان-ملف-المحروقات-و/,2026-06-09,https://reportage.ly/,2026-06-10T15:36:26Z,not_in_final_report,missing_article_body,needs_review,in_range
RNA Reportage,المركزي يعلن تعرض منظوماته وخدماته التقنية لحادث سيبراني,https://reportage.ly/المركزي-يعلن-تعرض-منظوماته-وخدماته-ا/,2026-06-09,https://reportage.ly/,2026-06-10T15:36:26Z,not_in_final_report,missing_article_body,needs_review,in_range
LANA,الأهلي طرابلس والأهلي بنغازي في نهائي كأس ليبيا على أرضية استاد القاهرة الدولي,https://lana.gov.ly/post.php?lang=ar&id=359041,2026-06-09,https://lana.gov.ly/category.php?lang=ar&id=8,2026-06-10T15:35:47Z,not_in_final_report,sports_or_entertainment,rejected,in_range
LANA,الشرطة السويسرية تعثر على جثمان الدكتورة الليبية أبرار بن رمضان .,https://lana.gov.ly/post.php?lang=ar&id=358708,2026-06-09,https://lana.gov.ly/category.php?lang=ar&id=8,2026-06-10T15:35:47Z,not_in_final_report,low_editorial_value,rejected,in_range
LANA,يوم الحسم.. النصر والسويحلي في مواجهة نهائية لتحديد بطل الدوري الممتاز,https://lana.gov.ly/post.php?lang=ar&id=358833,2026-06-09,https://lana.gov.ly/category.php?lang=ar&id=8,2026-06-10T15:35:47Z,not_in_final_report,sports_or_entertainment,rejected,in_range
LANA,( وال) خبير أرصاد ليبي: سحب استوائية عبرت ليبيا من الجنوب إلى الشمال في ظاهرة لم أشهد مثيلاً لها منذ 1980.,https://lana.gov.ly/post.php?lang=ar&id=358819,2026-06-09,https://lana.gov.ly/category.php?lang=ar&id=8,2026-06-10T15:35:47Z,not_in_final_report,sports_or_entertainment,rejected,in_range
LANA,اقتراب موعد الحسم.. النصر والسويحلي يستعدان لنهائي الدوري الليبي في القاهرة,https://lana.gov.ly/post.php?lang=ar&id=358733,2026-06-09,https://lana.gov.ly/category.php?lang=ar&id=8,2026-06-10T15:35:47Z,not_in_final_report,sports_or_entertainment,rejected,in_range
LANA,الأهلي طرابلس يتوج بكأس ليبيا للمرة الثانية توالياً ويحصد اللقب التاسع في تاريخه,https://lana.gov.ly/post.php?lang=ar&id=359084,2026-06-09,https://lana.gov.ly/category.php?lang=ar&id=8,2026-06-10T15:35:47Z,not_in_final_report,sports_or_entertainment,rejected,in_range
LANA,رئيس الأركان العامة يشدد على أهمية استيفاء وضمان حقوق مؤسسة الجيش الليبي ومنتسبيها.,https://lana.gov.ly/post.php?lang=ar&id=358943,2026-06-09,https://lana.gov.ly/category.php?lang=ar&id=8,2026-06-10T15:35:47Z,not_in_final_report,low_editorial_value,rejected,in_range
LANA,الصندوق الليبي للاستثمار الداخلي والتنمية يطلق منصة المستثمرين الرقمية الخاصة بمطار طرابلس الدولي,https://lana.gov.ly/post.php?lang=ar&id=359152,2026-06-10,https://lana.gov.ly/,2026-06-10T15:35:47Z,not_in_final_report,low_editorial_value,rejected,in_range
LANA,النمروش يتابع تنفيذ خطة تطوير وتنظيم المؤسسة العسكرية,https://lana.gov.ly/post.php?lang=ar&id=359144,2026-06-10,https://lana.gov.ly/,2026-06-10T15:35:47Z,not_in_final_report,low_editorial_value,rejected,in_range
LANA,لجنة تنظيم المسابقات بالاتحاد الليبي لكرة القدم تختتم موسم 2025-2026 وتثمن جهود شركاء النجاح,https://lana.gov.ly/post.php?lang=ar&id=359137,2026-06-10,https://lana.gov.ly/,2026-06-10T15:35:47Z,not_in_final_report,sports_or_entertainment,rejected,in_range
LANA,انتشال جثة غريق بمدينة غات ، والهلال الأحمر يحذر من السباحة في بحيرات السيول,https://lana.gov.ly/post.php?lang=ar&id=359134,2026-06-10,https://lana.gov.ly/,2026-06-10T15:35:47Z,not_in_final_report,low_editorial_value,rejected,in_range
LANA,برنت يؤكد من بنغازي دعم واشنطن لجهود توحيد المؤسسة العسكرية الليبية,https://lana.gov.ly/post.php?lang=ar&id=359126,2026-06-10,https://lana.gov.ly/,2026-06-10T15:35:47Z,not_in_final_report,low_editorial_value,rejected,in_range
LANA,الباعور يبحث مع نائبة وزير خارجية اليونان ترسيم الحدود البحريةو التعاون في المجالات اللاقتصادية والطاقة,https://lana.gov.ly/post.php?lang=ar&id=359143,2026-06-10,https://lana.gov.ly/,2026-06-10T15:35:47Z,not_in_final_report,low_editorial_value,approved,in_range
LANA,بلدية سبها تشكل لجنة لتنظيم توزيع وقود الديزل,https://lana.gov.ly/post.php?lang=ar&id=359136,2026-06-10,https://lana.gov.ly/,2026-06-10T15:35:47Z,not_in_final_report,low_editorial_value,approved,in_range
LANA,حكومة الوحدة الوطنية تعقد اجتماعها العادي الثالث لعام 2026 برئاسة رئيس الحكومة عبد الحميد الدبيبة.,https://lana.gov.ly/post.php?lang=ar&id=359121,2026-06-10,https://lana.gov.ly/,2026-06-10T15:35:47Z,not_in_final_report,low_editorial_value,approved,in_range
LANA,التوقيع على اتفاقية التشغيل الموحدة لحقل I/R بحوض مرزق .,https://lana.gov.ly/post.php?lang=ar&id=359119,2026-06-10,https://lana.gov.ly/,2026-06-10T15:35:47Z,not_in_final_report,low_editorial_value,approved,in_range
LANA,فرق الشركة العامة للكهرباء تنفذ أعمال صيانة عاجلة وتحسن استقرار التغذية بعدة مدن,https://lana.gov.ly/post.php?lang=ar&id=359118,2026-06-10,https://lana.gov.ly/,2026-06-10T15:35:47Z,not_in_final_report,low_editorial_value,approved,in_range
LANA,وزارة التعليم : أكثر من 211 ألف تلميذ يؤدون أولى امتحانات شهادة التعليم الأساسي في الداخل والخارج,https://lana.gov.ly/post.php?lang=ar&id=359117,2026-06-10,https://lana.gov.ly/,2026-06-10T15:35:47Z,not_in_final_report,low_editorial_value,approved,in_range
